{
  "schema_version": "1.0",
  "call_id": "call_01",
  "task_id": "task_01",
  "action_id": "action_01",
  "agent_id": "agent_product_manager",
  "tool_id": "file-tool",
  "tool_version": "1.0.0",
  "action": "read_file",
  "arguments": {"path": "/product/prd.md"},
  "idempotency_key": "task_01:action_01:1",
  "permission_context": {"grant_ids": ["grant_product_docs_read"]},
  "approval_id": null,
  "deadline": "2026-08-04T10:00:10Z",
  "trace_id": "trace_01",
  "attempt": 1
}
